<?xml version='1.0'?>
<!DOCTYPE platform SYSTEM "http://simgrid.gforge.inria.fr/simgrid.dtd">
<platform version="3">

  <process host="Jacquelin" function="node">
    <argument value="0x0000"/>          <!-- my id -->
    <argument value ="900"/>            <!-- deadline -->
  </process>

  <process host="Boivin" function="node">
    <argument value="0x0001"/>          <!-- my id -->
    <argument value="0"/>               <!-- known id -->
    <argument value ="900"/>            <!-- deadline -->
  </process>

  <process host="Jean_Yves" function="node">
    <argument value="0x0003"/>          <!-- my id -->
    <argument value="0x0001"/>          <!-- known id -->
    <argument value ="900"/>            <!-- deadline -->
  </process>

  <process host="TeX" function="node">
    <argument value="0x0007"/>          <!-- my id -->
    <argument value="0x0003"/>          <!-- known id -->
    <argument value ="900"/>            <!-- deadline -->
  </process>
  <process host="Geoff" function="node">
    <argument value="0x000f"/>          <!-- my id -->
    <argument value="0x0007"/>          <!-- known id -->
    <argument value ="900"/>            <!-- deadline -->
  </process>
  <process host="Disney" function="node">
    <argument value="0x001f"/>          <!-- my id -->
    <argument value="0x000f"/>          <!-- known id -->
    <argument value ="900"/>            <!-- deadline -->
  </process>
  <process host="iRMX" function="node">
    <argument value="0x003f"/>          <!-- my id -->
    <argument value="0x001f"/>          <!-- known id -->
    <argument value ="900"/>            <!-- deadline -->
  </process>
  <process host="McGee" function="node">
    <argument value="0x007f"/>          <!-- my id -->
    <argument value="0x003f"/>          <!-- known id -->
    <argument value ="900"/>            <!-- deadline -->
  </process>
  <process host="Gatien" function="node">
    <argument value="0x00ff"/>          <!-- my id -->
    <argument value="0x007f"/>          <!-- known id -->
    <argument value ="900"/>            <!-- deadline -->
  </process>
  <process host="Laroche" function="node">
    <argument value="0x01ff"/>          <!-- my id -->
    <argument value="0x00ff"/>          <!-- known id -->
    <argument value ="900"/>            <!-- deadline -->
  </process>
  <process host="Tanguay" function="node">
    <argument value="0x03ff"/>          <!-- my id -->
    <argument value="0x01ff"/>          <!-- known id -->
    <argument value ="900"/>            <!-- deadline -->
  </process>
   <process host="Morin" function="node">
    <argument value="0x07ff"/>          <!-- my id -->
    <argument value="0x03ff"/>          <!-- known id -->
    <argument value ="900"/>            <!-- deadline -->
  </process>
   <process host="Ethernet" function="node">
    <argument value="0x0fff"/>          <!-- my id -->
    <argument value="0x0000"/>          <!-- known id -->
    <argument value ="900"/>            <!-- deadline -->
  </process>
</platform>
