<?xml version='1.0'?>
<!DOCTYPE platform SYSTEM "http://simgrid.gforge.inria.fr/simgrid.dtd">
<platform version="3">
  <!-- The master process (with some arguments) -->
  <process host="Tremblay" function="master">
     <argument value="20"/>       <!-- Number of tasks -->
     <argument value="50000000"/>  <!-- Computation size of tasks -->
     <argument value="1000000"/>   <!-- Communication size of tasks -->
     <argument value="Jupiter"/>  <!-- First slave -->
     <argument value="Fafard"/>   <!-- Second slave -->
     <argument value="Ginette"/>  <!-- Third slave -->
     <argument value="Bourassa"/> <!-- Last slave -->
     <argument value="Tremblay"/> <!-- Me! I can work too! -->
  </process>
  <!-- The slave process (with no argument) -->
  <process host="Tremblay" function="slave" on_failure="RESTART"/>
  <process host="Jupiter" function="slave" on_failure="RESTART"/>
  <process host="Fafard" function="slave" on_failure="RESTART"/>
  <process host="Ginette" function="slave" on_failure="RESTART"/>
  <process host="Bourassa" function="slave" on_failure="RESTART"/>
</platform>
