<?xml version='1.0'?>
<!DOCTYPE platform SYSTEM "http://simgrid.gforge.inria.fr/simgrid.dtd">
<platform version="3">
  <process host="alice" function="host">
    <argument value = "c:\Windows\setupact.log"/>
  </process>
  <process host="bob" function="host">
    <argument value = "/scratch/lib/libsimgrid.so.3.6.2"/>
    <argument value = "/scratch/doc/simgrid/examples/platforms/g5k.xml"/>
    <argument value = "alice"/>
    <argument value = "c:\Windows\Platforms\g5k.xml"/>
    <argument value = "0"/>
  </process>
  <process host="carl" function="host">
    <argument value = "/scratch/lib/libsimgrid.so.3.6.2"/>
  </process>
  <process host="dave" function="host">
    <argument value = "c:\Windows\bootstat.dat"/>
    <argument value = "c:\Windows\Professional.xml"/>
    <argument value = "carl"/>
    <argument value = "/scratch/mailbox/Professional.xml"/>
    <argument value = "1"/>
  </process>
</platform>
