<?xml version='1.0'?>
 <!DOCTYPE platform SYSTEM "http://simgrid.gforge.inria.fr/simgrid.dtd">
 <platform version="3">
 <AS  id="AS0"  routing="Full">
   <cluster id="bob_cluster" prefix="bob" suffix=".hamburger.edu"
 	   radical="0-4" power="1Gf" bw="125MBps" lat="50us"
 	   bb_bw="2.25GBps" bb_lat="500us"/>
 
   <cluster id="alice_cluster" prefix="alice" suffix=".crepe.fr"
 	   radical="0-4" power="1Gf" bw="125MBps" lat="50us"
 	   bb_bw="2.25GBps" bb_lat="500us"/>
 
   <link id="backbone" bandwidth="1.25GBps" latency="500us"/>
 
   <route:multi src="bob_cluster" dst="alice_cluster" symmetric="YES">
     <link_ctn id="backbone"/>
     <link_ctn id="$dst"/>
   </route:multi>
 
   <route:multi src="bob0.hamburger.edu" dst="$*" action="OVERRIDE" symmetric="NO">
     <link_ctn id="$src"/>
     <link_ctn id="backbone"/>
     <link_ctn id="$dst"/>
   </route:multi>
 
   <route:multi src="bob0.hamburger.edu" dst="bob_cluster" action="OVERRIDE" symmetric="NO">
     <link_ctn id="$src"/>
     <link_ctn id="bob_cluster_bb"/>
     <link_ctn id="$dst"/>
   </route:multi>
 
 </AS>
 </platform>
