<?xml version='1.0'?>
 <!DOCTYPE platform SYSTEM "http://simgrid.gforge.inria.fr/simgrid.dtd">
 
 <!-- This file describe a super simple platform which main interest is
      to define some properties on hosts, processes and links. 
      It is used in several regression cases on properties -->
 
 <platform version="3">
 <AS  id="AS0"  routing="Full">
   <prop id="filename" value="prop.xml"/>
   <prop id="date" value="31-08-12"/>
   <prop id="author" value="pnavarro"/>
   
   <AS  id="AS3"  routing="Full">
	   <AS id="AS1" routing="None">
	       <prop id="name" value="AS1"/>
	   </AS>
	   
	   <AS id="AS2" routing="None">
	       <prop id="name" value="AS2"/>
	   </AS>
   </AS>
   
   <AS  id="AS4"  routing="Full">
	   <host id="host1" power="1Gf">
	     <prop id="Hdd" value="180"/>
	     <prop id="mem" value="4"/>
	   </host>
	   
	   <host id="host2" power="1Gf">
	     <prop id="Hdd" value="120"/>
	   </host>
	   
	   <link id="l1" bandwidth="125MBps" latency="100us">
	     <prop id="type" value="Ethernet"/>
	   </link>
	   
	   <link id="l2" bandwidth="125MBps" latency="100us">
	     <prop id="type" value="ethernet"/>
	   </link>
	   <route src="host1" dst="host2"><link_ctn id="l1"/><link_ctn id="l2"/></route>
   </AS>
 </AS>
 </platform>
