<?xml version='1.0'?>
<!DOCTYPE platform SYSTEM "http://simgrid.gforge.inria.fr/simgrid.dtd">
<platform version="3">
  <!-- The master process (with some arguments) -->
  <process host="Tremblay" function="master">
     <argument value="20"/>       <!-- Number of tasks -->
     <argument value="50000000"/>  <!-- Computation size of tasks -->
     <argument value="1000000"/>   <!-- Communication size of tasks -->
     <argument value="5"/>         <!-- Number of slaves -->
  </process>
  <!-- The slave processes (with mailbox to listen on as argument) -->
  <process host="Tremblay" function="slave"/>
  <process host="Jupiter" function="slave"/>
  <process host="Fafard" function="slave"/>
  <process host="Ginette" function="slave"/>
  <process host="Bourassa" function="slave"/>

</platform>
