<?xml version='1.0'?>
 <!DOCTYPE platform SYSTEM "http://simgrid.gforge.inria.fr/simgrid.dtd">
 <platform version="3">
 <AS  id="AS0"  routing="Full">
   <host id="HostA" power="137.333Mf"/>
   <host id="HostB" power="98.095Mf"/>
   <host id="HostC" power="98.095Mf"/>
   <host id="HostD" power="98.095Mf"/>
   <link id="1" bandwidth="3.430125MBps" latency="536.941us"/>
   <link id="2" bandwidth="3.430125MBps" latency="536.941us"/>
   <link id="3" bandwidth="3.430125MBps" latency="536.941us"/>
   <route src="HostA" dst="HostB"><link_ctn id="1"/></route>
   <route src="HostA" dst="HostC"><link_ctn id="2"/></route>
   <route src="HostA" dst="HostD"><link_ctn id="3"/></route>
 </AS>
 </platform>
 
