<?xml version='1.0'?>
 <!DOCTYPE platform SYSTEM "http://simgrid.gforge.inria.fr/simgrid.dtd">
 <platform version="3">
   <AS  id="AS0"  routing="Full">
     <host id="Tremblay" power="25Mf"/>
     <host id="Jupiter" power="25Mf" 
           availability_file="jupiter_power.trace"/>

     <link id="1" bandwidth="125MBps" latency="100us" 
           bandwidth_file="link1_avail.trace"/>
     
     <route src="Tremblay" dst="Jupiter">
       <link_ctn id="1"/>
     </route>
   </AS>

   <trace id="Tremblay_power" periodicity="6.0">
     1.0 0.5
     4.0 1.0
   </trace>

   <trace_connect trace="Tremblay_power" element="Tremblay" kind="POWER"/>
</platform>  
